{
  "$schema": "https://json-schema.org/draft/2020-12/schema",
  "$id": "https://example.invalid/omnius/event-envelope.schema.json",
  "title": "Versioned Event Envelope",
  "type": "object",
  "required": [
    "id",
    "type",
    "version",
    "source",
    "subject",
    "occurred_at",
    "correlation_id",
    "data"
  ],
  "properties": {
    "id": {
      "type": "string",
      "format": "uuid"
    },
    "type": {
      "type": "string",
      "pattern": "^[a-z][a-z0-9_.-]+\\.v[0-9]+$"
    },
    "version": {
      "type": "integer",
      "minimum": 1
    },
    "source": {
      "type": "string",
      "minLength": 1
    },
    "subject": {
      "type": "string",
      "minLength": 1
    },
    "tenant_id": {
      "type": [
        "string",
        "null"
      ],
      "format": "uuid"
    },
    "occurred_at": {
      "type": "string",
      "format": "date-time"
    },
    "correlation_id": {
      "type": "string",
      "format": "uuid"
    },
    "causation_id": {
      "type": [
        "string",
        "null"
      ],
      "format": "uuid"
    },
    "traceparent": {
      "type": [
        "string",
        "null"
      ]
    },
    "data": {
      "type": "object"
    },
    "metadata": {
      "type": "object"
    }
  },
  "additionalProperties": false
}
